{
  "title": "CMP-001 — SFIA Notion Sync",
  "status": "Active",
  "type": "Connector",
  "criticality": "High",
  "currentVersion": "ID: CMP-001 | Nom: SFIA Notion Sync | Version: v1.0.0 | Statut: Stable | Catégorie: Core Component | Domaine: Knowledge Platform | Production Ready: Oui | Tests: 10/10 validés\n\nDescription:\nConnecteur officiel permettant de créer et mettre à jour les objets SFIA dans Notion via l'API Notion.\n\nObjectif:\nStandardiser les échanges entre la plateforme SFIA et Notion.\n\nFonctionnalités:\n- Découverte automatique des bases\n- Génération automatique du fichier .env\n- Création des objets du Domain Model\n- Validation JSON\n- Tests automatisés\n\nDocumentation: README.md | Changelog: CHANGELOG.md | Roadmap: roadmap.md",
  "repository": "https://github.com/sfia-platform/sfia-notion-sync",
  "documentation": "https://github.com/sfia-platform/sfia-notion-sync/blob/main/README.md"
}
